### ISSUE TITLE
Leaking opened connections and file descriptors

### ISSUE THREAD

**Issue by rixed** [mirage/ocaml-cohttp#578]
This simple HTTP client fails to properly close the connection (notice the `Connection:close` header):

```ocaml
(* Assuming the source file is named bug.ml, compile with:
    ocamlfind ocamlopt -annot -package "lwt.ppx cohttp-lwt-unix" -linkpkg bug.ml -o bug
*)
open Lwt

let () =
  let thread =
    let open Cohttp in
    let open Cohttp_lwt_unix in
    let body = `String "Hello there!" in
    let url = Uri.of_string "http://www.google.com" in
    let rec forever () =
      let headers = Header.init_with "Content-Type" "text/plain" in
      let headers = Header.add headers "Connection" "close" in
      let%lwt resp, _body = Client.put ~headers ~body url in
      let code = resp |> Response.status |> Code.code_of_status in
      if code <> 200 then
        Printf.fprintf stderr "Received code %d" code ;
      Lwt_unix.sleep 10. >>=
      forever in
    forever ()
  in

  Lwt_main.run thread
```
When run, you can clearly see that it does not close the connection:

```
% sudo tcpdump -ni wlp2s0 tcp port 80
17:55:14.004821 IP 192.168.1.4.60968 > 74.125.206.103.80: Flags [S], seq 353523057, win 29200, options [mss 1460,sackOK,TS val 7958298 ecr 0,nop,wscale 7], length 0
17:55:14.019705 IP 74.125.206.103.80 > 192.168.1.4.60968: Flags [S.], seq 441269529, ack 353523058, win 42408, options [mss 1380,sackOK,TS val 1821192869 ecr 7958298,nop,wscale 8], length 0
17:55:14.019730 IP 192.168.1.4.60968 > 74.125.206.103.80: Flags [.], ack 1, win 229, options [nop,nop,TS val 7958302 ecr 1821192869], length 0
17:55:14.019811 IP 192.168.1.4.60968 > 74.125.206.103.80: Flags [P.], seq 1:136, ack 1, win 229, options [nop,nop,TS val 7958302 ecr 1821192869], length 135: HTTP: PUT / HTTP/1.1
17:55:14.038710 IP 74.125.206.103.80 > 192.168.1.4.60968: Flags [.], ack 136, win 170, options [nop,nop,TS val 1821192886 ecr 7958302], length 0
17:55:14.039611 IP 74.125.206.103.80 > 192.168.1.4.60968: Flags [.], seq 1:1419, ack 136, win 170, options [nop,nop,TS val 1821192888 ecr 7958302], length 1418: HTTP: HTTP/1.1 405 Method Not Allowed
17:55:14.039638 IP 192.168.1.4.60968 > 74.125.206.103.80: Flags [.], ack 1419, win 251, options [nop,nop,TS val 7958307 ecr 1821192888], length 0
17:55:14.039662 IP 74.125.206.103.80 > 192.168.1.4.60968: Flags [P.], seq 1419:1835, ack 136, win 170, options [nop,nop,TS val 1821192888 ecr 7958302], length 416: HTTP
17:55:14.039671 IP 192.168.1.4.60968 > 74.125.206.103.80: Flags [.], ack 1835, win 273, options [nop,nop,TS val 7958307 ecr 1821192888], length 0
17:55:14.039679 IP 74.125.206.103.80 > 192.168.1.4.60968: Flags [F.], seq 1835, ack 136, win 170, options [nop,nop,TS val 1821192888 ecr 7958302], length 0
17:55:14.083258 IP 192.168.1.4.60968 > 74.125.206.103.80: Flags [.], ack 1836, win 273, options [nop,nop,TS val 7958318 ecr 1821192888], length 0

17:55:24.050815 IP 192.168.1.4.60970 > 74.125.206.103.80: Flags [S], seq 4062846065, win 29200, options [mss 1460,sackOK,TS val 7960809 ecr 0,nop,wscale 7], length 0
17:55:24.065997 IP 74.125.206.103.80 > 192.168.1.4.60970: Flags [S.], seq 1678121051, ack 4062846066, win 42408, options [mss 1380,sackOK,TS val 1691169771 ecr 7960809,nop,wscale 8], length 0
17:55:24.066058 IP 192.168.1.4.60970 > 74.125.206.103.80: Flags [.], ack 1, win 229, options [nop,nop,TS val 7960813 ecr 1691169771], length 0
17:55:24.066292 IP 192.168.1.4.60970 > 74.125.206.103.80: Flags [P.], seq 1:136, ack 1, win 229, options [nop,nop,TS val 7960813 ecr 1691169771], length 135: HTTP: PUT / HTTP/1.1
17:55:24.082457 IP 74.125.206.103.80 > 192.168.1.4.60970: Flags [.], ack 136, win 170, options [nop,nop,TS val 1691169788 ecr 7960813], length 0
17:55:24.088373 IP 74.125.206.103.80 > 192.168.1.4.60970: Flags [.], seq 1:1419, ack 136, win 170, options [nop,nop,TS val 1691169792 ecr 7960813], length 1418: HTTP: HTTP/1.1 405 Method Not Allowed
17:55:24.088414 IP 192.168.1.4.60970 > 74.125.206.103.80: Flags [.], ack 1419, win 251, options [nop,nop,TS val 7960819 ecr 1691169792], length 0
17:55:24.088981 IP 74.125.206.103.80 > 192.168.1.4.60970: Flags [P.], seq 1419:1835, ack 136, win 170, options [nop,nop,TS val 1691169792 ecr 7960813], length 416: HTTP
17:55:24.089003 IP 192.168.1.4.60970 > 74.125.206.103.80: Flags [.], ack 1835, win 273, options [nop,nop,TS val 7960819 ecr 1691169792], length 0
17:55:24.089022 IP 74.125.206.103.80 > 192.168.1.4.60970: Flags [F.], seq 1835, ack 136, win 170, options [nop,nop,TS val 1691169792 ecr 7960813], length 0
17:55:24.131289 IP 192.168.1.4.60970 > 74.125.206.103.80: Flags [.], ack 1836, win 273, options [nop,nop,TS val 7960830 ecr 1691169792], length 0
^C
```
and that the file descriptors are accumulating:

```
% l /proc/$(pidof bug)/fd
total 0
lrwx------ 1 rixed rixed 64 Sep 21 17:55 0 -> /dev/pts/5
lrwx------ 1 rixed rixed 64 Sep 21 17:55 1 -> /dev/pts/5
lrwx------ 1 rixed rixed 64 Sep 21 17:58 10 -> socket:[896528]
lrwx------ 1 rixed rixed 64 Sep 21 17:58 11 -> socket:[896551]
lrwx------ 1 rixed rixed 64 Sep 21 17:58 12 -> socket:[896556]
lrwx------ 1 rixed rixed 64 Sep 21 17:58 13 -> socket:[899562]
lrwx------ 1 rixed rixed 64 Sep 21 17:58 14 -> socket:[900281]
lrwx------ 1 rixed rixed 64 Sep 21 17:58 15 -> socket:[900293]
lrwx------ 1 rixed rixed 64 Sep 21 17:58 16 -> socket:[900318]
lrwx------ 1 rixed rixed 64 Sep 21 17:58 17 -> socket:[900445]
lrwx------ 1 rixed rixed 64 Sep 21 17:58 18 -> socket:[900446]
lrwx------ 1 rixed rixed 64 Sep 21 17:58 19 -> socket:[900498]
lrwx------ 1 rixed rixed 64 Sep 21 17:55 2 -> /dev/pts/5
lrwx------ 1 rixed rixed 64 Sep 21 17:58 20 -> socket:[900500]
lrwx------ 1 rixed rixed 64 Sep 21 17:58 21 -> socket:[899856]
lrwx------ 1 rixed rixed 64 Sep 21 17:58 22 -> socket:[900557]
lrwx------ 1 rixed rixed 64 Sep 21 17:58 23 -> socket:[900580]
lrwx------ 1 rixed rixed 64 Sep 21 17:58 24 -> socket:[900619]
lrwx------ 1 rixed rixed 64 Sep 21 17:55 3 -> anon_inode:[eventfd]
lrwx------ 1 rixed rixed 64 Sep 21 17:55 4 -> socket:[893022]
lrwx------ 1 rixed rixed 64 Sep 21 17:55 5 -> socket:[893027]
lrwx------ 1 rixed rixed 64 Sep 21 17:55 6 -> socket:[891362]
lrwx------ 1 rixed rixed 64 Sep 21 17:58 7 -> socket:[891402]
lrwx------ 1 rixed rixed 64 Sep 21 17:58 8 -> socket:[891493]
lrwx------ 1 rixed rixed 64 Sep 21 17:58 9 -> socket:[891507]
```

I cannot think of any use case to keep this connection open in this direction for doing anything HTTP,
so I think the connection should be closed both way and the fd reclaimed.

Alternatively, is there a way to force the close?

**Comment by hcarty** [comment]
You need to consume the response body with `Cohttp_lwt_body.to_string`, `Cohttp_lwt_body.drain_body` or similar.

I'm not sure if there is a way to close the connection without consuming the response body.

**Comment by rixed** [comment]
True, so this case is closed. Now for the real meat, let's add a UDP listener:

```
open Lwt

let () =
  let with_udp_listener =
    Array.length Sys.argv > 1 in

  let thread1 =
    let open Cohttp in
    let open Cohttp_lwt_unix in
    let body = `String "Hello there!" in
    let url = Uri.of_string "http://www.google.com" in
    let rec forever () =
      let headers = Header.init_with "Content-Type" "text/plain" in
      let headers = Header.add headers "Connection" "close" in
      let%lwt resp, _body = Client.put ~headers ~body url in
      let%lwt () = Cohttp_lwt_body.drain_body body in
      let code = resp |> Response.status |> Code.code_of_status in
      if code <> 200 then
        Printf.fprintf stderr "Received code %d" code ;
      Lwt_unix.sleep 10. >>=
      forever in
    forever ()

  and thread2 =
    let open Lwt_unix in
    if with_udp_listener then (
      Printf.printf "Listening...\n%!" ;
      let sock = socket PF_INET SOCK_DGRAM 0 in
      let%lwt () = bind sock (ADDR_INET (Unix.inet_addr_any, 37123)) in
      let buffer = Bytes.create 1500 in
      let rec forever () =
        let%lwt _ = recvfrom sock buffer 0 (Bytes.length buffer) [] in
        forever () in
      forever ()
    ) else
      sleep 999.
  in

  Lwt_main.run (
    join [ thread1 ; thread2 ])
```

FINs disapeared again:

```
~ % sudo tcpdump -ni any tcp port 80
tcpdump: verbose output suppressed, use -v or -vv for full protocol decode
listening on any, link-type LINUX_SLL (Linux cooked), capture size 262144 bytes
08:35:08.868635 IP 192.168.1.4.47486 > 74.125.206.105.80: Flags [S], seq 96293634, win 29200, options [mss 1460,sackOK,TS val 353018 ecr 0,nop,wscale 7], length 0
08:35:08.883899 IP 74.125.206.105.80 > 192.168.1.4.47486: Flags [S.], seq 304847508, ack 96293635, win 42408, options [mss 1380,sackOK,TS val 3200389290 ecr 353018,nop,wscale 8], length 0
08:35:08.883931 IP 192.168.1.4.47486 > 74.125.206.105.80: Flags [.], ack 1, win 229, options [nop,nop,TS val 353022 ecr 3200389290], length 0
08:35:08.884341 IP 192.168.1.4.47486 > 74.125.206.105.80: Flags [P.], seq 1:136, ack 1, win 229, options [nop,nop,TS val 353022 ecr 3200389290], length 135: HTTP: PUT / HTTP/1.1
08:35:08.898711 IP 74.125.206.105.80 > 192.168.1.4.47486: Flags [.], ack 136, win 170, options [nop,nop,TS val 3200389306 ecr 353022], length 0
08:35:08.902843 IP 74.125.206.105.80 > 192.168.1.4.47486: Flags [.], seq 1:1419, ack 136, win 170, options [nop,nop,TS val 3200389307 ecr 353022], length 1418: HTTP: HTTP/1.1 405 Method Not Allowed
08:35:08.902886 IP 192.168.1.4.47486 > 74.125.206.105.80: Flags [.], ack 1419, win 251, options [nop,nop,TS val 353027 ecr 3200389307], length 0
08:35:08.904273 IP 74.125.206.105.80 > 192.168.1.4.47486: Flags [P.], seq 1419:1835, ack 136, win 170, options [nop,nop,TS val 3200389307 ecr 353022], length 416: HTTP
08:35:08.904301 IP 192.168.1.4.47486 > 74.125.206.105.80: Flags [.], ack 1835, win 273, options [nop,nop,TS val 353027 ecr 3200389307], length 0
08:35:08.904319 IP 74.125.206.105.80 > 192.168.1.4.47486: Flags [F.], seq 1835, ack 136, win 170, options [nop,nop,TS val 3200389307 ecr 353022], length 0
08:35:08.946911 IP 192.168.1.4.47486 > 74.125.206.105.80: Flags [.], ack 1836, win 273, options [nop,nop,TS val 353038 ecr 3200389307], length 0
```

and consequently fds are leaking:

```
~ % l /proc/$(pidof bug)/fd         
total 0
lrwx------ 1 rixed rixed 64 Oct  3 08:35 0 -> /dev/pts/1
lrwx------ 1 rixed rixed 64 Oct  3 08:35 1 -> /dev/pts/1
lrwx------ 1 rixed rixed 64 Oct  3 08:35 10 -> socket:[62738]
lrwx------ 1 rixed rixed 64 Oct  3 08:35 2 -> /dev/pts/1
lrwx------ 1 rixed rixed 64 Oct  3 08:35 3 -> anon_inode:[eventfd]
lrwx------ 1 rixed rixed 64 Oct  3 08:35 4 -> socket:[60301]
lrwx------ 1 rixed rixed 64 Oct  3 08:35 5 -> socket:[60302]
lrwx------ 1 rixed rixed 64 Oct  3 08:35 6 -> socket:[62589]
lrwx------ 1 rixed rixed 64 Oct  3 08:35 7 -> socket:[62646]
lrwx------ 1 rixed rixed 64 Oct  3 08:35 8 -> socket:[62651]
lrwx------ 1 rixed rixed 64 Oct  3 08:35 9 -> socket:[62731]
```

I noticed this in one of my program, where when I add a UDP service (which works) the unrelated HTTP service (unrelated on theory but apparently not really) starts to leak fds.

Looks like normal Unix.socket and conduit does not coexist peacefully?

**Comment by mseri** [comment]
I was double-checking if this is still an issue, and running the code above it looked like the case, until the terminal started showing the new warning:
```
Cohttp_lwt: body not consumed - leaking stream!
Cohttp_lwt: body not consumed - leaking stream!
Cohttp_lwt: body not consumed - leaking stream!
Cohttp_lwt: body not consumed - leaking stream!
Cohttp_lwt: body not consumed - leaking stream!
Cohttp_lwt: body not consumed - leaking stream!
```

Indeed, there is a typo:
```diff
     let%lwt resp, _body = Client.put ~headers ~body url in
-    let%lwt () = Cohttp_lwt_body.drain_body body in
+    let%lwt () = Cohttp_lwt_body.drain_body _body in
```

When you change this the leak disappears. It without leaking (or the relative logs) for over 10 minutes already.

**Comment by rixed** [comment]
I think the typo is the other way around, and that you should have instead:

```
let%lwt resp, body = Client.put ~headers ~body url in
```

ie. get rid of the prefix `_` in body, since it is now used.

**Comment by mseri** [comment]
Indeed. I did not want to shadow the `body` defined above, so went with the less pretty change.
