### ISSUE TITLE
Cohttp dies when 'Connection' header is 'close'

### ISSUE THREAD

**Issue by ericbmerritt** [mirage/ocaml-cohttp#144]
Its seems that cohttp dies when the connection header is set to close. Below is the error from cohttp (async) and the tshark dumps for the working and non working calls.
### Cohttp Log

```
((pid 10326) (thread_id 0) (2014-05-20 16:14:02.366536Z)
 "unhandled exception in Async scheduler"
 ("unhandled exception"
  ((lib/monitor.ml.Error_
    ((exn
      ("can not read from reader"
       (closed
        ((fd
          ((file_descr 7)
           (info
            (socket
             ((listening_on
               ((type_
                 ((family
                   ((family PF_INET) (address_of_sockaddr_exn <fun>)
                    (sexp_of_address <fun>)))
                  (socket_type SOCK_STREAM)))
                (fd
                 ((file_descr 6)
                  (info
                   (replaced
                    (listening
                     (previously_was
                      (replaced
                       ((socket (bound_on (Inet (0.0.0.0 53211))))
                        (previously_was
                         (socket
                          ((family
                            ((family PF_INET) (address_of_sockaddr_exn <fun>)
                             (sexp_of_address <fun>)))
                           (socket_type SOCK_STREAM))))))))))
                  (kind (Socket Passive)) (supports_nonblock true)
                  (have_set_nonblock true) (state (Close_requested <fun>))
                  (watching ((read Stop_requested) (write Not_watching)))
                  (watching_has_changed true) (num_active_syscalls 1)
                  (close_finished Empty)))))
              (client (Inet (127.0.0.1 34138))))))
           (kind (Socket Active)) (supports_nonblock true)
           (have_set_nonblock true) (state Closed)
           (watching ((read Not_watching) (write Not_watching)))
           (watching_has_changed false) (num_active_syscalls 0)
           (close_finished (Full ()))))
         (id 6) (buf <opaque>) (close_may_destroy_buf Yes) (pos 0)
         (available 0) (bin_prot_len_buf <opaque>) (bin_prot_buf <opaque>)
         (state Closed) (close_finished (Full ()))
         (last_read_time (2014-05-20 16:13:59.248177Z))
         (open_flags (Full (Ok (rdwr))))))))
     (backtrace
      ("Raised at file \"lib/error.ml\", line 7, characters 21-29"
       "Called from file \"lib/reader0.ml\", line 904, characters 2-7"
       "Called from file \"async/cohttp_async_io.ml\", line 39, characters 7-26"
       "Called from file \"cohttp/request.ml\", line 91, characters 4-16"
       "Called from file \"cohttp/request.ml\", line 106, characters 4-29"
       "Called from file \"async/cohttp_async.ml\", line 200, characters 10-25"
       "Called from file \"lib/reader0.ml\", line 788, characters 10-20"
       "Called from file \"lib/deferred.ml\", line 119, characters 6-13"
       "Called from file \"lib/jobs.ml\", line 214, characters 10-13" ""))
     (monitor
      (((name Tcp.collect_errors) (here ()) (id 318) (has_seen_error true)
        (someone_is_listening true) (kill_index 0))))))
   (Pid 10326))))
```
### Working Tshark dump

```
Frame 4: 447 bytes on wire (3576 bits), 447 bytes captured (3576 bits)
    Arrival Time: May 20, 2014 16:09:36.265477000 UTC
    Epoch Time: 1400602176.265477000 seconds
    [Time delta from previous captured frame: 0.000058000 seconds]
    [Time delta from previous displayed frame: 0.000000000 seconds]
    [Time since reference or first frame: 0.000075000 seconds]
    Frame Number: 4
    Frame Length: 447 bytes (3576 bits)
    Capture Length: 447 bytes (3576 bits)
    [Frame is marked: False]
    [Frame is ignored: False]
    [Protocols in frame: sll:ip:tcp:http]
Linux cooked capture
    Packet type: Unicast to us (0)
    Link-layer address type: 772
    Link-layer address length: 6
    Source: 00:00:00_00:00:00 (00:00:00:00:00:00)
    Protocol: IP (0x0800)
Internet Protocol Version 4, Src: 127.0.0.1 (127.0.0.1), Dst: 127.0.0.1 (127.0.0.1)
    Version: 4
    Header length: 20 bytes
    Differentiated Services Field: 0x00 (DSCP 0x00: Default; ECN: 0x00: Not-ECT (Not ECN-Capable Transport))
        0000 00.. = Differentiated Services Codepoint: Default (0x00)
        .... ..00 = Explicit Congestion Notification: Not-ECT (Not ECN-Capable Transport) (0x00)
    Total Length: 431
    Identification: 0x9f61 (40801)
    Flags: 0x02 (Don't Fragment)
        0... .... = Reserved bit: Not set
        .1.. .... = Don't fragment: Set
        ..0. .... = More fragments: Not set
    Fragment offset: 0
    Time to live: 64
    Protocol: TCP (6)
    Header checksum: 0x9be5 [correct]
        [Good: True]
        [Bad: False]
    Source: 127.0.0.1 (127.0.0.1)
    Destination: 127.0.0.1 (127.0.0.1)
Transmission Control Protocol, Src Port: 34133 (34133), Dst Port: 53211 (53211), Seq: 1, Ack: 1, Len: 379
    Source port: 34133 (34133)
    Destination port: 53211 (53211)
    [Stream index: 0]
    Sequence number: 1    (relative sequence number)
    [Next sequence number: 380    (relative sequence number)]
    Acknowledgement number: 1    (relative ack number)
    Header length: 32 bytes
    Flags: 0x018 (PSH, ACK)
        000. .... .... = Reserved: Not set
        ...0 .... .... = Nonce: Not set
        .... 0... .... = Congestion Window Reduced (CWR): Not set
        .... .0.. .... = ECN-Echo: Not set
        .... ..0. .... = Urgent: Not set
        .... ...1 .... = Acknowledgement: Set
        .... .... 1... = Push: Set
        .... .... .0.. = Reset: Not set
        .... .... ..0. = Syn: Not set
        .... .... ...0 = Fin: Not set
    Window size value: 513
    [Calculated window size: 32832]
    [Window size scaling factor: 64]
    Checksum: 0xffa3 [validation disabled]
        [Good Checksum: False]
        [Bad Checksum: False]
    Options: (12 bytes)
        No-Operation (NOP)
        No-Operation (NOP)
        Timestamps: TSval 1010774, TSecr 1010774
            Kind: Timestamp (8)
            Length: 10
            Timestamp value: 1010774
            Timestamp echo reply: 1010774
    [SEQ/ACK analysis]
        [Bytes in flight: 379]
Hypertext Transfer Protocol
    GET /v1/seats HTTP/1.1\r\n
        [Expert Info (Chat/Sequence): GET /v1/seats HTTP/1.1\r\n]
            [Message: GET /v1/seats HTTP/1.1\r\n]
            [Severity level: Chat]
            [Group: Sequence]
        Request Method: GET
        Request URI: /v1/seats
        Request Version: HTTP/1.1
    Host: 10.0.1.202\r\n
    Cache-Control: max-age=0\r\n
    Accept: text/html,application/xhtml+xml,application/xml;q=0.9,image/webp,*/*;q=0.8\r\n
    User-Agent: Mozilla/5.0 (Macintosh; Intel Mac OS X 10_9_2) AppleWebKit/537.36 (KHTML, like Gecko) Chrome/34.0.1847.137 Safari/537.36\r\n
    Accept-Encoding: gzip,deflate,sdch\r\n
    Accept-Language: en-US,en;q=0.8,es-419;q=0.6,es;q=0.4\r\n
    \r\n
    [Full request URI: http://10.0.1.202/v1/seats]
```
### Non working

```
Frame 4: 466 bytes on wire (3728 bits), 466 bytes captured (3728 bits)
    Arrival Time: May 20, 2014 16:13:59.247580000 UTC
    Epoch Time: 1400602439.247580000 seconds
    [Time delta from previous captured frame: 0.000059000 seconds]
    [Time delta from previous displayed frame: 0.000000000 seconds]
    [Time since reference or first frame: 0.000075000 seconds]
    Frame Number: 4
    Frame Length: 466 bytes (3728 bits)
    Capture Length: 466 bytes (3728 bits)
    [Frame is marked: False]
    [Frame is ignored: False]
    [Protocols in frame: sll:ip:tcp:http]
Linux cooked capture
    Packet type: Unicast to us (0)
    Link-layer address type: 772
    Link-layer address length: 6
    Source: 00:00:00_00:00:00 (00:00:00:00:00:00)
    Protocol: IP (0x0800)
Internet Protocol Version 4, Src: 127.0.0.1 (127.0.0.1), Dst: 127.0.0.1 (127.0.0.1)
    Version: 4
    Header length: 20 bytes
    Differentiated Services Field: 0x00 (DSCP 0x00: Default; ECN: 0x00: Not-ECT (Not ECN-Capable Transport))
        0000 00.. = Differentiated Services Codepoint: Default (0x00)
        .... ..00 = Explicit Congestion Notification: Not-ECT (Not ECN-Capable Transport) (0x00)
    Total Length: 450
    Identification: 0x2bea (11242)
    Flags: 0x02 (Don't Fragment)
        0... .... = Reserved bit: Not set
        .1.. .... = Don't fragment: Set
        ..0. .... = More fragments: Not set
    Fragment offset: 0
    Time to live: 64
    Protocol: TCP (6)
    Header checksum: 0x0f4a [correct]
        [Good: True]
        [Bad: False]
    Source: 127.0.0.1 (127.0.0.1)
    Destination: 127.0.0.1 (127.0.0.1)
Transmission Control Protocol, Src Port: 34138 (34138), Dst Port: 53211 (53211), Seq: 1, Ack: 1, Len: 398
    Source port: 34138 (34138)
    Destination port: 53211 (53211)
    [Stream index: 0]
    Sequence number: 1    (relative sequence number)
    [Next sequence number: 399    (relative sequence number)]
    Acknowledgement number: 1    (relative ack number)
    Header length: 32 bytes
    Flags: 0x018 (PSH, ACK)
        000. .... .... = Reserved: Not set
        ...0 .... .... = Nonce: Not set
        .... 0... .... = Congestion Window Reduced (CWR): Not set
        .... .0.. .... = ECN-Echo: Not set
        .... ..0. .... = Urgent: Not set
        .... ...1 .... = Acknowledgement: Set
        .... .... 1... = Push: Set
        .... .... .0.. = Reset: Not set
        .... .... ..0. = Syn: Not set
        .... .... ...0 = Fin: Not set
    Window size value: 513
    [Calculated window size: 32832]
    [Window size scaling factor: 64]
    Checksum: 0xffb6 [validation disabled]
        [Good Checksum: False]
        [Bad Checksum: False]
    Options: (12 bytes)
        No-Operation (NOP)
        No-Operation (NOP)
        Timestamps: TSval 1076520, TSecr 1076520
            Kind: Timestamp (8)
            Length: 10
            Timestamp value: 1076520
            Timestamp echo reply: 1076520
    [SEQ/ACK analysis]
        [Bytes in flight: 398]
Hypertext Transfer Protocol
    GET /v1/seats HTTP/1.1\r\n
        [Expert Info (Chat/Sequence): GET /v1/seats HTTP/1.1\r\n]
            [Message: GET /v1/seats HTTP/1.1\r\n]
            [Severity level: Chat]
            [Group: Sequence]
        Request Method: GET
        Request URI: /v1/seats
        Request Version: HTTP/1.1
    Host: 10.0.1.202\r\n
    Connection: close\r\n
    Cache-Control: max-age=0\r\n
    Accept: text/html,application/xhtml+xml,application/xml;q=0.9,image/webp,*/*;q=0.8\r\n
    User-Agent: Mozilla/5.0 (Macintosh; Intel Mac OS X 10_9_2) AppleWebKit/537.36 (KHTML, like Gecko) Chrome/34.0.1847.137 Safari/537.36\r\n
    Accept-Encoding: gzip,deflate,sdch\r\n
    Accept-Language: en-US,en;q=0.8,es-419;q=0.6,es;q=0.4\r\n
    \r\n
    [Full request URI: http://10.0.1.202/v1/seats]
```
